{
  "format": "sw.run",
  "schemaVersion": "0.1.0",
  "id": "run.decay",
  "modelRef": "models/exponential-decay.system.json",
  "start": {
    "num": "0",
    "den": "1"
  },
  "stop": {
    "num": "1",
    "den": "1"
  },
  "solver": {
    "method": "rk4-fixed@1",
    "fixedStep": {
      "num": "1",
      "den": "100"
    },
    "absTol": 1e-10,
    "relTol": 1e-10
  },
  "inputs": [],
  "seed": "0",
  "probes": [
    "x"
  ]
}
